Q,Toxicity_score,T,Toxicity_score
>>8200492 Primary purpose of referencing 'Twitter' accounts? TOGETHER you are invincible.  CONNECTED. UNITED. WWG1WGA!!! Q,0.08969927,"Much of the bad blood with Russia is caused by the Fake &amp, Corrupt Russia Investigation, headed up by the all Democrat loyalists, or people that worked for Obama. Mueller is most conflicted of all (except Rosenstein who signed FISA &amp, Comey letter). No Collusion, so they go crazy!",0.5571116
>>7536175 https://twitter.com/elenochle/status/1204129788065042433   DO YOU BELIEVE IN COINCIDENCE?  (anon colab),0.08864012,"When will this illegal Joseph McCarthy style Witch Hunt, one that has shattered so many innocent lives, ever end-or will it just go on forever? After wasting more than $40,000,000 (is that possible?), it has proven only one thing-there was NO Collusion with Russia. So Ridiculous!",0.74162835
https://www.gchq.gov.uk/person/jeremy-fleming  Name worth remembering. Q,0.08830971,"....No Pressure at all said Ukraine! Very congenial, a perfect call. The Whistleblower and others spoke BEFORE seeing the Transcript. Now they must apologize to me and stop this ridiculous impeachment!",0.7144284
"https://twitter.com/duffing_it_up/status/1194039578753003521  MSM constant attacks? Ask yourself, why? Q",0.08697266,"....looking for trouble. They are enjoying ruining people’s lives and REFUSE to look at the real corruption on the Democrat side - the lies, the firings, the deleted Emails and soooo much more! Mueller’s Angry Dems are looking to impact the election. They are a National Disgrace!",0.5876557
"[Feb 11 2019] ""Step Four: Open 'new' Fake & False investigations as CHAIRMAN of the House Intel Comm to retain disinformation campaign designed to keep liberal/D Americans onboard to regain POWER & PREVENT prosecution - Executive Time!"" - Q Pre_public_awareness? LIKE CLOCKWORK. [D][1-6] Enjoy the show! Q",0.0863838,The Do Nothing Democrats have become the Party of lies and deception! The Republicans are the Party of the American Dream!,0.5991599
GOD WINS,0.086350046,"CNN is being torn apart from within based on their being caught in a major lie and refusing to admit the mistake. Sloppy @carlbernstein, a man who lives in the past and thinks like a degenerate fool, making up story after story, is being laughed at all over the country! Fake News",0.81914806
Why are the [2] articles being held by Pelosi? Will holding actually impact the decision of the Senate? No. Will holding actually provide a better scenario [public opinion] to [D]s?  No. Will holding actually 'sway' select Senators to change their vote?  No.  When blackmail and threats no longer work……. Why are the [2] articles being held by Pelosi? What happens when the articles of impeachment are sent from the House to the Senate? Can the Senate conduct 'other' business during this time? No. What 'value' might exist by holding the articles? How long do Senate impeachment trials normally take? What statements have been made re: timing? Think 'fast-tracking'. What statements have been made by Chairman Graham re: Senate FISA hearing(s) & witnesses? WHY IS PELOSI HOLDING THE [2] ARTICLES OF IMPEACHMENT? Q,0.08546514,"Mini Mike Bloomberg is a LOSER who has money but can’t debate and has zero presence, you will see. He reminds me of a tiny version of Jeb “Low Energy” Bush, but Jeb has more political skill and has treated the Black community much better than Mini! https://t.co/qIef5VhjDr",0.794439
>>7942819 Play a game of 'Where Are They Now?'. Think CEOs. Think FBI. Think DOJ. Think WH. Think State. Think C_A. Think [F] intel. ……….. Think Judge install. Think SC install. Think DOJ install. Think FBI install. Think C_A install. Think PM UK install. Think! THE BEST IS YET TO COME. Q,0.084961995,"“Incomes much higher under Trump than Bush, Obama.” @foxandfriends And almost everything else is better also (except I am driving the Deep State, and the Radical Left, Do Nothing Democrats, CRAZY)!",0.52097267
https://www.foxnews.com/politics/adam-schiffs-own-ukraine-connection-comes-under-scrutiny  Q,0.08475598,"Unbelievably, James Comey states that Polls, where Crooked Hillary was leading, were a factor in the handling (stupidly) of the Clinton Email probe. In other words, he was making decisions based on the fact that he thought she was going to win, and he wanted a job. Slimeball!",0.53490317
"https://twitter.com/ABC/status/1227640976363212800  ""Far-right conspiratorial writer who has no credibility…."" - [CS] PANIC IN DC! Q",0.0843237,"While the disgusting Fake News is doing everything within their power not to report it that way, at least 3 major players are intimating that the Angry Mueller Gang of Dems is viciously telling witnesses to lie about facts &amp, they will get relief. This is our Joseph McCarthy Era!",0.54964954
"https://twitter.com/FollowQanon/status/1206045134036582400  FAKE NEWS hiding the TRUTH? ""Knowingly."" We, the People. Enjoy the show! Q",0.084237844,"As ridiculous as it sounds, the laws of our country do not easily allow us to send those crossing our Southern Border back where they came from. A whole big wasted procedure must take place. Mexico &amp, Canada have tough immigration laws, whereas ours are an Obama joke. ACT CONGRESS",0.6818015
"Read [1] https://www.miamiherald.com/news/politics-government/article237959369.html  Read [2] https://www.miamiherald.com/news/politics-government/article214974800.html  5:5? Welcome to the [D] party. Well done, Anons.  Q",0.08420505,....to pay. Open area immediately for medical help and verification. Another humanitarian disaster for no reason whatsoever. SICK!,0.53490317
https://www.nationalreview.com/corner/born-alive-abortion-survivors-protection-act-fails-in-the-senate/  Q,0.082965836,"According to NBC News, Voters Nationwide Disapprove of the so-called Mueller Investigation (46%) more than they Approve (41%). You mean they are finally beginning to understand what a disgusting Witch Hunt, led by 17 Angry Democrats, is all about!",0.56155175
http://www.youtube.com/watch?v=YJnQnD9EXnw  Q,0.08278858,"The @foxnewPolls, always inaccurate, are heavily weighted toward Dems. So ridiculous - same thing happened in 2016. They got it all wrong. Get a new pollster!",0.6364068
">>7965933 Pelosi claims Trump 'violated the constitution' in weekly press briefing 27,810 views•Streamed live 89 minutes ago  Speaker Pelosi holds her weekly press briefing.  https://youtu.be/ltdHdxOu76g",0.08273155,"The Impeachment Witch Hunt should be over with the statement made last night by the President and Foreign Minister of Ukraine. Nervous Nancy Pelosi, who should be home cleaning up the dangerous &amp, disgusting Slum she is making of her District in San Francisco, where even the......",0.5320398
https://twitter.com/Pismo_B/status/1223275776163794945  What happens when people learn the TRUTH? What happens when people WAKE UP? They will not be able to walk down the street. THE GREAT AWAKENING. Q,0.08239566,"Unemployment for Black Americans is the lowest ever recorded. Trump approval ratings with Black Americans has doubled. Thank you, and it will get even (much) better! @FoxNews",0.53490317
https://www.starwars.com/games-apps/star-wars-commander  How do 'select' bad actors attempt comms w/o SIGINT collection? Rebellion or Empire? Private [invite only] faction(s)? Dark > Light Q,0.082240246,We won’t Steve! https://t.co/iKr859gKEL,0.59648305
Nothing can stop what is coming. Nothing! Rig for Red. Q,0.08209414,"Thank you to Lt. Bob Kroll of the great Minneapolis Police Department for your kind words on @foxandfriends. The Police are fighting the Radical Left Mayor, and his ridiculous Uniform Ban. Actually, I LOVE the Cops for Trump shirts. Want to bring some home. I am with you 100%!!!!",0.562284
For those who decide to save the taxpayers some money. There is no escaping God. Q,0.081657544,"Just watched Wacky Tom Steyer, who I have not seen in action before, be interviewed by @jaketapper. He comes off as a crazed &amp, stumbling lunatic who should be running out of money pretty soon. As bad as their field is, if he is running for President, the Dems will eat him alive!",0.59593034
>>7560835 Directly after a +? Sometimes after a long day one needs a little pick-me-up. Q,0.080417715,"Really pathetic how @FoxNews is trying to be so politically correct by loading the airwaves with Democrats like Chris Van Hollen, the no name Senator from Maryland. He has been on forever playing up the Impeachment Hoax. Dems wouldn’t even give Fox their low ratings debates....",0.7728102
https://www.senate.gov/artandhistory/history/common/briefing/Impeachment_Hastings.htm  Welcome to the [D] party con. Q,0.08038437,"What is the purpose of the House doing good immigration bills when you need 9 votes by Democrats in the Senate, and the Dems are only looking to Obstruct (which they feel is good for them in the Mid-Terms). Republicans must get rid of the stupid Filibuster Rule-it is killing you!",0.74490136
">>7359354 Images that are served via TOR broke yesterday, we are checking why and should have it fixed up soon. Caching is still a bit buggy, and likewise we should have that fixed up soon.  I will do my best to have these things fixed up before the end of the weekend.  An easy way to verify yourself after the upcoming salt rotation is: 1. Migrate /patriotsfight/ before the rotation 2. Post with current tripcode on /patriotsfight/ 3. After salt rotation, post with new tripcode on /patriotsfight/ 4. Qresearch BO adds your updated tripcode to the /qresearch/ whitelist  Let me know if you want to migrate /patriotsfight/. The login credentials will be the same as back in August, and you can login via tor at this url: http://sys.jthnx5wyvjvzsxtu.onion/mod.php?/  or via clearnet at this url: https://sys.jthnx5wyvjvzsxtu.onion/mod.php?/   The salt rotation is an important maintenance task, and will help improve overall site stability.   Our current tasks to get back to full stability: 0. Salt rotation 1. Fix quality-of-life bugs (caching, images, etc) 2. Launch project odin (checkmate against deplatforming) 3. Finish board migration 4. Migrate to a new ISP currently being setup (will improve site access speeds and stability) 5. Bring back board creation (with a simple vetting process) 6. Install the new captcha system that we are building 7. Extinguish fires that pop up",0.07975771,".....again said “NO,” thinking, as usual, that the U.S. is always the “sucker,” on NATO, on Trade, on everything. The Kurds fought with us, but were paid massive amounts of money and equipment to do so. They have been fighting Turkey for decades. I held off this fight for....",0.6049454
https://www.youtube.com/watch?v=0TFh1YJynGA  Phones were present. FISA goes both ways. Information warfare. Q,0.07898324,"....They want to Impeach me (I’m not worried!), and yet they were all breaking the law in so many ways. How can they do that and yet impeach a very successful (Economy Plus) President of the United States, who has done nothing wrong? These people are Crazy!",0.598683
https://www.youtube.com/watch?v=g1KfU5ifhqE  Follow the family. Q,0.0783915,"Internal REAL Polls show I am beating all of the Dem candidates. The Fake News Polls (here we go again, just like 2016) show losing or tied. Their polls will be proven corrupt on November 3rd, just like the Fake News is corrupt!",0.5876557
"http://twitter.com/WattersWorld/status/1203403806110699521  While a biased POV shelters/protects the host, the overall discussion [eyes on] generates awareness. Q",0.0783203,The Russian Witch Hunt is Rigged!,0.6590704
"""Calm Before the Storm."" - POTUS Month/Day 'Q' public campaign initiated?  Month/Day 'Durham' initiated? What famous crime family did Durham target? ""Also spearheaded mob prosecutions of the [Gambino], Genovese and Patriarca crime families."" http://content.time.com/time/nation/article/0,8599,1918738,00.html  What AB[C] agency did Durham target? How are messages sent? https://www.rollingstone.com/culture/culture-news/frank-cali-murder-mafia-boss-qanon-motive-anthony-comello-861777/  [Dec 12 2018]  ""What if there's another prosecutor (outside of DC) assigned by SESSIONS w/ the same mandate/authority?"" - Q Do you believe in coincidences? 5:5? Be ready, Patriots. Q",0.07820651,"We are not in a trade war with China, that war was lost many years ago by the foolish, or incompetent, people who represented the U.S. Now we have a Trade Deficit of $500 Billion a year, with Intellectual Property Theft of another $300 Billion. We cannot let this continue!",0.5876557
"Anons, why would we provide the date of the FISA release?  Logical thinking. Ammunition is finite.  Q",0.0779078,"The same people that got us into the Middle East Quicksand, 8 Trillion Dollars and many thousands of lives (and millions of lives when you count the other side), are now fighting to keep us there. Don’t listen to people that haven’t got a clue. They have proven to be inept!",0.6364068
https://twitter.com/M2Madness/status/1208769369171476480  WHY IS PELOSI HOLDING THE [2] ARTICLES OF IMPEACHMENT? How do you introduce the TRUTH about what happened to the PUBLIC? What 'value' might exist by attempting to BLOCK 'PUBLIC' testimony/hearings? Would educating the public through the Senate prior to Barr/Durham/Huber release(s) be important? Narratives are created and pushed to prevent the public from discovering the TRUTH. ENEMY OF THE PEOPLE. Q,0.077848166,"Mitt Romney never knew how to win. He is a pompous “ass” who has been fighting me from the beginning, except when he begged me for my endorsement for his Senate run (I gave it to him), and when he begged me to be Secretary of State (I didn’t give it to him). He is so bad for R’s!",0.7961116
[D] party leaders [‘Big 5’]: Rep. Nancy Pelosi (D-CA) – Speaker of the House Rep. Adam Schiff (D-CA) – Chair Intel  Rep. Jerry Nadler (D-NY) – Chair Judiciary  Sen. Chuck Schumer (D-NY) – Senate Minority Leader Sen. Dianne Feinstein (D-CA) – Ranking Mem Judiciary Control over [CA] & [NY] vital to maintain [D] structural integrity?  https://www.judicialwatch.org/press-releases/california-begins-massive-voter-roll-clean-up-notifies-up-to-1-5-million-inactive-voters-as-part-of-judicial-watch-lawsuit-settlement/  https://nypost.com/2019/06/18/law-granting-illegal-immigrants-drivers-licenses-could-lead-to-voter-fraud/  Leverage (control) dictates how far you rise within the [D] party. Q,0.07734386,"A vicious accuser of Justice Kavanough has just admitted that she was lying, her story was totally made up, or FAKE! Can you imagine if he didn’t become a Justice of the Supreme Court because of her disgusting False Statements. What about the others? Where are the Dems on this?",0.5154597
DNC server(s). Crowdstrike. Did Russia 'break-in' to DNC server(s)? Why did FBI accept 'indirect' evidence re: DNC server(s) 'hack''break-in' by Crowdstrike [Ukraine]?  Why didn't FBI 'directly' investigate DNC server(s) [in-hand]? Download speed internal data DL vs remote? [1] https://www.realclearpolitics.com/video/2017/01/02/assange_to_hannity_our_source_was_not_the_russian_government.html  [1] How does one provide content to WL? >comp-to-comp >person-to-person [1] Personal comms [secured] prior to release? [1] The (Source(s)): >Feeder [1] >Recipient [1] Interning for the DNC can be deadly. Does Crowdstrike possess 'gov_capablity' to trace 'break-in' route(s)? Does Crowdstrike possess 'gov_capability' re: foreign intercepts? Possible to layer/insert code [Crowdstrike] to designate intruder [intended target]? NSA data_bridge DNC-Crowdstrike [bulk data collection] Matters of National Security [Highest Levels]. FISA is only the beginning. The hole is DEEP. Q,0.07727566,"“It’s about the Economy, stupid”, except when it comes to Trump. The fact is, the Fake News Media hates talking about the Economy, and how incredible it is!",0.8355208
There is no STEP FIVE. -END- Q,0.07718988,"If it was the GOAL of Russia to create discord, disruption and chaos within the U.S. then, with all of the Committee Hearings, Investigations and Party hatred, they have succeeded beyond their wildest dreams. They are laughing their asses off in Moscow. Get smart America!",0.6001247
https://www.foxnews.com/politics/doj-relents-says-it-would-be-okay-with-probation-for-michael-flynn  Q,0.07663306,“I’d strip the whole bunch of them. They’re all corrupt. They’ve all abused their power. They’ve all betrayed the American people with a political agenda. They tried to steal and influence an election in the United States.” @seanhannity,0.5335249
https://twitter.com/GOPLeader/status/1208818029578137602  Q,0.07614141,"Can’t believe they are not going after Schumer for the threats he made to our cherished United States Supreme Court, and our two great Justices. If a Republican did that, there would be an endless price to pay. Pathetic!",0.79706484
https://twitter.com/SeekretAgent/status/1194312252104544256  What are the odds of that? Mathematically impossible? Coincidence? The TRUTH is right in front of you. Q,0.075986885,"As hard as I work, &amp, as successful as our Country has become with our Economy, our Military &amp, everything else, it is ashame that the Democrats make us spend so much time &amp, money on this ridiculous Impeachment Lite Hoax. I should be able to devote all of my time to the REAL USA!",0.5876557
https://twitter.com/KarluskaP/status/1226271939142004737  An informed public threatens those in power. Q,0.075420976,Schiff is a lying disaster for our Country. He should resign! https://t.co/ytwEy5NasJ,0.5383996
Castle clean. Q,0.074963234,“Schiff aides worked with Whistleblower.” @foxandfriends  @RepLeeZeldin  Schiff is a lying mess!,0.5154597
Same evidence to FREE FLYNN currently being used to INDICT others [GJ]? [302]_mod [1] count. Who listened in [2] count [FISA?] ………… [6] counts. FBI agent [1][P] - FLYNN interview…….. If FISA warrant was ILLEGAL………. If FISA warrant predicated on ILLEGAL/UNCORROBORATED…….. If FISA 'actors' purposely withheld exculpatory evidence from the court…………. [Watch] what happens next. Q,0.073836744,"Too bad we didn’t have the G-7 here. I offered to pick up the entire cost, would have saved at least $35,000,000 for the USA. Best location. Very stupid people thought I would gain. Wrong! Looking at Camp David. Will announce soon. https://t.co/8RF7IHVyxN",0.7093121
"https://2009-2017.state.gov/documents/organization/119629.pdf  ""Insurgency is the organized use of subversion and violence to seize, nullify or challenge political control of a region."" The presidency of Barack Hussein Obama began at noon EST on January 20, 2009, when Barack Obama was inaugurated as the 44th President of the United States. What Country was the true intended target? Q",0.07379871,"“Very concerned about Comey’s firing, afraid they will be exposed,” said Bruce Ohr. DOJ’s Emails &amp, Notes show Bruce Ohr’s connection to (phony &amp, discredited) Trump Dossier. A creep thinking he would get caught in a dishonest act. Rigged Witch Hunt!",0.5587191
"https://www.grassley.senate.gov/sites/default/files/constituents/2017-07-20%20CEG%20to%20DOJ%20%28Ukraine%20DNC%20FARA%29.pdf  Read carefully. Re-read carefully. Spy_insert [EC] known? Re-read drops re: Spy_insert. What do these people have in common? Pelosi's son Kerry's son Romney's son Biden's son Hint: Geo location: Ukraine Hint: Energy Coincidence? When [GS] calls, D's always answer. Nothing can stop what is coming. Nothing! Q",0.07371075,All starting to unravel with the ridiculous 9 year sentence recommendation! https://t.co/6baxv3Lvuk,0.5876557
https://twitter.com/wokesocieties/status/1208139679528357889  Something BIG is coming. https://twitter.com/realDonaldTrump/status/1208873492025925632  Do people really think this can happen with no consequences?  FISA = START NOBODY is above the law [not anymore]. Q,0.073462635,A Dirty Cop at the highest level. Scum! https://t.co/9t2qETqgcL,0.794439
>>7516554 Exact time of Durham statement? Think Q/Durham start date. Coincidence?  Having fun yet? Q,0.0733698,"When a car is sent to the United States from China, there is a Tariff to be paid of 2 1/2%. When a car is sent to China from the United States, there is a Tariff to be paid of 25%. Does that sound like free or fair trade.  No, it sounds like STUPID TRADE -  going on for years!",0.7093121
Confirmed. Q,0.0726883,"Mini Mike is getting slammed. His debates were, perhaps, the worst in presidential debating history. A total phony who disavowed “Stop &amp; Frisk” after swearing by it for years, and even recently. He horribly overused it, &amp; then dropped when running as a Dem. A total phony!",0.5188964
https://twitter.com/RealSaavedra/status/1229510910739279873  Purpose: [D]s install numerous rules and regs re: [D] party nomination winner?  Define 'superdelegates'.  How do you control the outcome? Why is the outcome important? When [GS] calls who races to answer? [ILLUSION OF DEMOCRACY] Q,0.07254051,Wow! Hunter Biden is being forced to leave a Chinese Company. Now watch the Fake News wrap their greasy and very protective arms around him. Only softball questions of him please!,0.5529881
Future trip(c) re_verify: Notebook Pen Watch  Desk —————— Anon interaction coming soon. Q,0.07252876,"The people of Iran are finally acting against the brutal and corrupt Iranian regime. All of the money that President Obama so foolishly gave them went into terrorism and into their “pockets.” The people have little food, big inflation and no human rights. The U.S. is watching!",0.62190515
https://twitter.com/Solmemes1/status/1197668953113481216  THE GREAT AWAKENING. You are the news now. Handle w/ care. Q,0.072339386,"The inner workings of the Mueller investigation are a total mess. They have found no collusion and have gone absolutely nuts. They are screaming and shouting at people, horribly threatening them to come up with the answers they want. They are a disgrace to our Nation and don’t...",0.60474306
Anons IDEN the 'error' made re: Corney v Comey? Think recent doc release.  Q,0.072202496,"All of the fools that are so focused on looking only at Russia should start also looking in another direction, China. But in the end, if we are smart, tough and well prepared, we will get along with everyone!",0.71948117
https://twitter.com/Incarcerated_ET/status/1198990090757914625  Enemy of the People. You are the news now. Facts matter. Q,0.07208895,"The Rigged Russian Witch Hunt goes on and on as the “originators and founders” of this scam continue to be fired and demoted for their corrupt and illegal activity. All credibility is gone from this terrible Hoax, and much more will be lost as it proceeds. No Collusion!",0.6261649
https://www.youtube.com/watch?v=8y06NSBBRtY  Q,0.07203956,"More text messages between former FBI employees Peter Strzok and Lisa Page are a disaster and embarrassment to the FBI &amp, DOJ. This should never have happened but we are learning more and more by the hour. “Others were leaking like mad” in order to get the President! ........",0.5154597
https://twitter.com/realDonaldTrump/status/1236980284744241154  Silent running is a tactic used when…. Q,0.07202936,"“U.S. Intelligence official overstated assessment of Russian efforts to help Trump.” @FoxNews @GreggJarrett They supposedly told Crazy Bernie that Russia was looking at him, not me. This is all a big scam between Intel and the Democrats. They want Bernie OUT, &amp; hate “Trump”.",0.5626111
>>7536263 Worth remembering. Q,0.07179476,"Mike Pompeo is doing a great job, I am very proud of him. His predecessor, Rex Tillerson, didn’t have the mental capacity needed. He was dumb as a rock and I couldn’t get rid of him fast enough. He was lazy as hell. Now it is a whole new ballgame, great spirit at State!",0.743655
>>8251669 Godspeed. Q,0.0717875,"Charles Koch of Koch Brothers, who claims to be giving away millions of dollars to politicians even though I know very few who have seen this (?), now makes the ridiculous statement that what President Trump is doing is unfair to “foreign workers.” He is correct, AMERICA FIRST!",0.5618151
https://twitter.com/Education4Libs/status/1243022336137351169  The Silent War continues.. Q,0.071711674,Crooked Hillary caught again. She is a total train wreck! https://t.co/iqtuwzbaIV,0.5652454
Backchannels are important. Know your history and you will know why. Q,0.071589395,"“The reason they are not sending the Articles of Impeachment to the Senate is that they are so weak and so pathetic.” @LindseyGrahamSC @MariaBartiromo  The great Scam continues. To be spending time on this political Hoax at this moment in our history, when I am so busy, is sad!",0.7693689
212-397-2255 Operators are standing by. Q,0.071544334,"....should give their own transcripts of the interviews to contrast with Schiff’s manipulated propaganda. House Republicans must have nothing to do with Shifty’s rendition of those interviews. He is a proven liar, leaker &amp, freak who is really the one who should be impeached!",0.7093121
https://www.theepochtimes.com/nsa-director-rogers-disclosed-fisa-abuse-days-after-carter-page-fisa-was-issued_2692033.html  Important to read and understand. Something BIG is coming. Q,0.07123716,"Stock Markets Up Record Numbers. For this year alone, Dow up 18.65%, S&amp,P up 24.36%, Nasdaq Composite up 29.17%. “It’s the economy, stupid.”",0.794439
