Q,Toxicity_score,T,Toxicity_score
These people are stupid. Q,0.9325978,"Despite the Democrat inspired laws on Sanctuary Cities and the Border being so bad and one sided, I have instructed the Secretary of Homeland Security not to let these large Caravans of people into our Country. It is a disgrace. We are the only Country in the World so naive! WALL",0.53082144
>>8200462  Baker already noted Q.  Missed heaps of other shit but got this,0.90234405,The Caravans are a disgrace to the Democrat Party. Change the immigration laws NOW!,0.5578606
https://www.congress.gov/106/cdoc/tdoc16/CDOC-106tdoc16.pdf  These people are stupid. Q,0.86022687,"Where’s the Whistleblower? Just read the Transcript, everything else is made up garbage by Shifty Schiff and the Never Trumpers!",0.6036486
shit  search dep.justice and look what you find re corney  https://search.justice.gov/search?query=corney&op=Search&affiliate=justice   https://www.justice.gov/oip/foia-library/foia-processed/general_topics/actions_dag_appointment_mueller/download  …confinned by then-FBI Director James 8. Corney in testimony before the House Permanent  James 8 Corney,0.61211485,The “Times” is a disgrace to journalism! https://t.co/gfMc6fIbfI,0.73720074
Relevant to today re: F assets. Deconstruction of foreign controlled [intel] US media [+alt] critical.  Untouchable re: State backed? Epstein thought so. Puppets & Puppet Masters. Q,0.5154597,Another terrorist attack in London...These animals are crazy and must be dealt with through toughness and strength!,0.6485034
Relevant to today re: F assets. Deconstruction of foreign controlled [intel] US media [+alt] critical.  Untouchable re: State backed? Epstein thought so. Puppets & Puppet Masters. Q,0.5154597,....immediately fire back if a savage sicko came to a school with bad intentions. Highly trained teachers would also serve as a deterrent to the cowards that do this. Far more assets at much less cost than guards. A “gun free” school is a magnet for bad people. ATTACKS WOULD END!,0.63713425
http://twitter.com/DailyCaller/status/1203343309311266816  Corrupt. Think Harvard. Think tax break. Think political career. Corrupt. DRAIN THE SWAMP! Q,0.5042395,“Clapper lied about (fraudulent) Dossier leaks to CNN” @foxandfriends FoxNews  He is a lying machine who now works for Fake News CNN.,0.6552314
https://twitter.com/michaelbeatty3/status/1214427316866011136  https://www.youtube.com/watch?v=j0uCrA7ePno  Open your eyes to see the TRUTH. Who are the REAL racists?  Q,0.5025958,"Just won lawsuit filed by the DNC and a bunch of Democrat crazies trying to claim the Trump Campaign (and others), colluded with Russia. They haven’t figured out that this was an excuse for them losing the election!",0.53490317
https://www.nationalreview.com/corner/born-alive-bill-fails-to-pass-senate-vote/  These people are sick! Q,0.47507378,"Texas &amp; Oklahoma: Mini Mike Bloomberg will kill your drilling, fracking and pipelines. Petroleum based “anything” is dead. Energy jobs gone. Don’t vote for Mini Mike!",0.5605629
All assets [F + D] being deployed. [Some] who once supported POTUS [sleepers] have/will turn [puppets & puppet masters]. Control of narrative = control of public opinion Control of public opinion = power EVERYTHING IS AT STAKE. OLD GUARD POWER STRUCTURE BEING DESTROYED. WASHINGTON CIVIL WAR [CONTROL THE NARRATIVE]. PREV EXPOSURE OF TRUTH. [SELF PRESERVATION] FIGHTING FOR SURVIVAL. INFORMATION WARFARE. Q,0.44863346,What he did is illegal. Schiff is a corrupt politician and a criminal! https://t.co/uLzJY5MjW3,0.6028669
"Corrupt [D]s fighting for their lives to keep media/gov focused on POTUS. Don't worry, it won't be boring forever.  Q",0.42661864,"....the American public’s tone deafness - &amp, it should be intolerable, because the American people have had it with this.” @kilmeade @foxandfriends  The Radical Left, Do Nothing Democrats have gone CRAZY. They want to make it as hard as possible for me to properly run our Country!",0.5154597
"https://twitter.com/M2Madness/status/1225606976912199680  If dirty cops ran the investigation into the DNC breach, could an argument be made that it was corrupt?  If dirty cops ran the investigation into election interference, could an argument be made that it was corrupt? If dirty cops ran the investigation into [HRC] private server/email scandal, could an argument be made that it was corrupt? RUSSIA DID NOT 'HACK' [penetrate] THE DNC SERVER. >internal DL / release >crowdstrike manipulation of source RUSSIA DID NOT INTERFERE WITH US ELECTION OF 2016. >crowdstrike manipulation of source The truth will be made public. Q",0.41709083,"....I have seen some of the regulations being circulated, including those being contemplated by Congress, and they are ridiculous. I want to make it EASY to do business with the United States, not difficult. Everyone in my Administration is being so instructed, with no excuses...",0.5361717
When a B2 bomber is no longer stealth (think public statements made last week) what must that signal?  Planned/coordinated attacks on BARR coming [smear campaign]. Public opinion is important.  Information warfare. A Traitor's Justice. Q,0.40310398,"The News Media in our Country is FAKE and in many cases, totally CORRUPT! https://t.co/hj9plf0GMC",0.6635589
https://twitter.com/RepAndyHarrisMD/status/1242178705050480640  PREVENT [[D] party destruction] BY ANY MEANS NECESSARY. These people are sick! Nothing can stop what is coming. Nothing. Q,0.3812681,"Things are really getting ridiculous. The Failing and Crooked (but not as Crooked as Hillary Clinton) @nytimes has done a long &amp, boring story indicating that the World’s most expensive Witch Hunt has found nothing on Russia &amp, me so now they are looking at the rest of the World!",0.5647176
>>7593781  Toying with the enemy!   Don't get smug.,0.35562328,John Kerry got caught essentially admitting that funds given ridiculously to Iran were used to fund attacks on the USA. Only a complete fool would have given that 150 Billion Dollars Plus to Iran. They then went on a Middle East Rampage! @foxandfriends @PeteHegseth,0.80291706
">>7561023 Also, think 'White Squal' re: Cuban M Crisis/JFK. Do comms only go to Anons? Bigger than you can imagine. Expand you're thinking. Q",0.350983,"RT @JohnVoight__: They still pretend they cannot see all of this , the are hypocrites we know... Keep up with the good work, you have my...",0.78620946
">>7561023 Also, think 'White Squal' re: Cuban M Crisis/JFK. Do comms only go to Anons? Bigger than you can imagine. Expand you're thinking. Q",0.350983,"Corrupt Congressman Adam Schiff is angry that Ambassadors that he thought would be good for his fraudulent Witch Hunt, are turning out to be good for me - some really good! He’s got all meetings locked down, no transparency, only his illegal leaks. A very dishonest sleazebag!",0.7748877
"The entire world is watching. Patriots from around the world are praying for AMERICA. We are all bound by a feeling deep inside, a feeling that cannot be publicly expressed for fear of ridicule, a feeling that challenges the mainstream (narrative), against that which we are told to accept and dare not question, put simply, that people are being abused by those in power and time is running out.  Remember the battles of Lexington and Concord - ""Give Me Liberty or Give Me Death!"" For far too long we have been silent and allowed our bands of strength, that we once formed to defend FREEDOM and LIBERTY, to deteriorate.  We became divided. We became weak. We elected TRAITORS to govern us. We allowed EVIL to prey on us. Those who claimed to represent us gave us false hope, made false promises. The evil and corruption only grew. —————————— This is more than party politics. This is about restoring OLD GLORY. This is about saving our land and our people from those who wish us harm. This is about preserving our REPUBLIC.  This is about preserving our SAFETY. This is about restoring our STRENGTH.  This is about LIFE, LIBERTY, and the PURSUIT OF HAPPINESS. This is about PROTECTING our children. THIS IS ABOUT SAVING AMERICA. We are all God's children. We are, FATHERS. We are, MOTHERS. We are, DAUGHTERS. We are, SONS. We are, BROTHERS. We are, SISTERS. We do not look at race. We do not look at skin color. We are UNITED in these STATES OF AMERICA. We are, and will always be, PATRIOTS. WE MUST RISE AGAIN. WE MUST UNITE AGAIN. WE MUST FIGHT AGAIN. FOR GOD & COUNTRY. GOD BLESS AMERICA. WWG1WGA!!! Q",0.3478905,"Congressman Adam Schiff should resign for the Crime of, after reading a transcript of my conversation with the President of Ukraine (it was perfect), fraudulently fabricating a statement of the President of the United States and reading it to Congress, as though mine! He is sick!",0.5732271
">>7557088 Friend/Patriot - hold your head up high.  POTUS was not harmed in any way today other than on paper (history books). Sometimes you must sacrifice yourself for the greater good. ""I will gladly take all those slings and arrows for you."" - POTUS But, even that, can be undone.  The enormity of what is coming will SHOCK THE WORLD. Pray. Q",0.34629655,"....&amp, overwhelming,” but this Scam Impeachment was neither. Also, very unfair with no Due Process, proper representation, or witnesses. Now Pelosi is demanding everything the Republicans weren’t alowed to have in the House. Dems want to run majority Republican Senate. Hypocrites!",0.76899755
"https://www.youtube.com/watch?v=WNqKhRcpktU  [16:00] ""Are we going to be sending massive amounts of money that simply goes into other people's [personal] bank account(s) [theft]."" - POTUS Who audits where foreign aid actually goes?  Nobody. Foreign aid > Country [X] > Personal Bank Accts [+US person(s) involved]. Think Iran. Think Paris Accord [attempt]. Think All. Corrupt system.  Do you think [GS] is spending his own money re: push of radical viewpoint adoption?  US TAXPAYER payments [aid] > directly/indirectly [GS] organizations?  Re-read drops re: 'Foreign Aid' https://www.youtube.com/watch?v=G2qIXXafxCQ&feature=youtu.be  [Listen carefully] RETURNING POWER TO THE PEOPLE. DRAINING THE SWAMP. POTUS IS FIGHTING FOR YOU. It's been a long time since we've had a non_corrupt POTUS who cares for the people, and not himself. Q",0.32698393,"The Republican Party, and me, had a GREAT day yesterday with respect to the phony Impeachment Hoax, &amp, yet, when I got home to the White House &amp, checked out the news coverage on much of television, you would have no idea they were reporting on the same event. FAKE &amp, CORRUPT NEWS!",0.616199
[infiltration instead of invasion] Q,0.32691184,"In Florida there is a choice between a Harvard/Yale educated man named @RonDeSantisFL who has been a great Congressman and will be a great Governor - and a Dem who is a thief and who is Mayor of poorly run Tallahassee, said to be one of the most corrupt cities in the Country!",0.56872094
"Think HRC Russia reset statement [Russia]. Think Hussein 'I'll have more flexibility after the election' hot mic statement to Russian depo re: Q to Hussein re: Putin. Think Hussein WH refusal to send weapons to Ukraine [R Congress push to assist] but instead sent only blankets. Think [D]s attack(s) re: POTUS for failure to 'protect' Ukraine against Russian aggression? [Impeachment] What advanced weapons did POTUS send to Ukraine? 2 + 2 = 6?  Define projection. Think $1,800,000,000 Hussein WH > Ukraine [which bank?]. Think US AID > Ukraine  Think WW AID > Ukraine Think U1 [sale of US uranium to Russia] Sold out US to benefit Russia for personal financial gain? Risked US National Security for personal financial gain? How was payment made to US person(s)? Think Ukraine. Think Iran. Russia & Iran allies?  Russia, Iran, & China allies?  US pol corruption China US pol corruption Ukraine [US leverage on behalf of…] US pol corruption Russia US pol corruption Iran Common denominator: China, Russia, and Iran: Closed financial systems? Logical thinking. Q",0.3216866,The Obama/Biden Administration is the most corrupt Administration in the history of our Country!,0.53490317
Control over the media has kept people in the dark.  Control over the media has kept people at heel (behind). Control over the media has kept people focused on falsehoods. Control over the media has kept people in a constant state of fear. Control over the media has divided our Republic into segments: >Race >Religion >Class >Political Affiliation  >Gender [weaponized]  When a citizenry is divided they have no 'collective' power.  When a citizenry has no 'collective' power they can no longer control the levers that govern them [levers of control]. [illusion of democracy] Q,0.31603166,"I hear that Fake News CNN just reported that I am isolated in the White House, wondering out loud, “when will life return to normal?” Does anybody really believe that? There was no leak, they made it up – they are CORRUPT &amp; FAKE NEWS....",0.53490317
Backchannels are important. Attacks will only intensify. You attack those who threaten you the most. Enjoy the show! Q,0.31092912,"So, if Comey &amp, the top people in the FBI were dirty cops and cheated on the FISA Court, wouldn’t all of these phony cases have to be overturned or dismissed? They went after me with the Fake Dossier, paid for by Crooked Hillary &amp, the DNC, which they illegally presented to FISA...",0.547024
https://www.foxnews.com/politics/trump-citizens-executive-order-census-count  Why are [D]s attempting to block the counting of 'illegal' immigrants? 2 + 2 = 4 What is the total number of illegal immigrants currently in the US? What is the 'real' total number of illegal immigrants currently in the US? By flooding coastal States controlled by [D]s does this 'pull' votes out of the Heartland?  At what point will your voice and your vote become null and void? 5:5? Q,0.31089434,"A so-called reporter named @JohnJHarwood, who bombed so badly in the 2016 Presidential Debates that I thought he was going to be immediately fired (a Mini Mike type performance), is now with Fake News @CNN. A total loser!",0.80480987
"Remember That the Democrats Sat While You Were Celebrated Last Night  I end a lot of articles about how the Democrats really feel about you by telling you to vote accordingly, but Trump’s State of the Union speech highlighted the Democrat’s utter contempt for President Donald Trump, you, and this country last night as they sat through almost every applause line that celebrated you doing well.  As the GOP highlighted in a video they posted to Twitter, the Democrats heard about the all-time low unemployment levels of the black community, the Hispanic community, the young adult community, and more. This should be a reason to celebrate. We should see our elected leaders getting to their feet and showing support, but instead only half the room decided to stand.  The other half, the Democrats, sat still, arms folded, and practically seethed at times.      Reminder for Democrats: It’s ok to applaud good news. pic.twitter.com/wH0DKNqx3D      — GOP (@GOP) February 5, 2020  https://www.redstate.com/brandon_morse/2020/02/05/remember-that-the-democrats-sat-while-you-were-celebrated-last-night/",0.29939815,...This evil Anti-Semitic attack is an assault on humanity. It will take all of us working together to extract the poison of Anti-Semitism from our world. We must unite to conquer hate.,0.53490317
"It must be done right. It must be done according to the rule of law. It must carry weight. It must be proven in the court of law. There can be no mistakes. Good things sometimes take time. Attempts to slow/block the inevitable [Justice] will fail. [D]s election interference 2016. >Clinton/Hussein illegal FISA [D]s election interference 2018. >Mueller  [D]s election interference 2020. >Impeachment Projection. These people are sick. We, the People, are the cure.  Q",0.29256326,"Our case against lyin’, cheatin’, liddle’ Adam “Shifty” Schiff, Cryin’ Chuck Schumer, Nervous Nancy Pelosi, their leader, dumb as a rock AOC, &amp; the entire Radical Left, Do Nothing Democrat Party, starts today at 10:00 A.M. on @FoxNews, @OANN or Fake News @CNN or Fake News MSDNC!",0.7659613
"It must be done right. It must be done according to the rule of law. It must carry weight. It must be proven in the court of law. There can be no mistakes. Good things sometimes take time. Attempts to slow/block the inevitable [Justice] will fail. [D]s election interference 2016. >Clinton/Hussein illegal FISA [D]s election interference 2018. >Mueller  [D]s election interference 2020. >Impeachment Projection. These people are sick. We, the People, are the cure.  Q",0.2925631,"The already discredited Woodward book, so many lies and phony sources, has me calling Jeff Sessions “mentally retarded” and “a dumb southerner.” I said NEITHER, never used those terms on anyone, including Jeff, and being a southerner is a GREAT thing. He made this up to divide!",0.76816297
>>8092721 Caught them all!,0.29130402,"The New York Times is an embarrassment to journalism. They were a dead paper before I went into politics, and they will be a dead paper after I leave, which will be in 5 years. Fake News is the Enemy of the people!",0.54426473
>>8246640 The Silent War continues.. Q,0.28746787,"A really big show tonight by @seanhannity  9:00 P.M. @FoxNews  Heavy emphasis on the Impeachment Hoax. The Radical Left, Do Nothing Democrats have gone crazy. They know it’s a con, but just can’t sell it! Public strongly against Impeachment.",0.5592933
AFIA AIA DIA ESC ITAC NOIC NPIC NSA SRD Q,0.27796715,"The biggest loser tonight, by far, is Mini Mike Bloomberg. His “political” consultants took him for a ride. $700 million washed down the drain, and he got nothing for it but the nickname Mini Mike, and the complete destruction of his reputation. Way to go Mike!",0.6314417
"BIGGER THAN YOU CAN IMAGINE. More than selling of State Secrets. More than selling of US security. More than selling of MIL tech. More than selling of C_A assets. More than selling of NSA bulk data collection programs. More than selling of Uranium.  More than selling of US Space NAT SEC programs & positions. More than selling of US AID.. More than selling of SAPs CLAS 1-99 ……………… >Crimes against Humanity. When you cannot destroy/defeat the United States of America by attacking head on, you change tactics and deploy a 'KILL FROM WITHIN' [internal] operation.  >Financial/Economy >Military/Police >Division of Citizenry  >Border Collapse  [Install 'like-minded' leaders in key positions of US Gov] How many people [removed] from the FBI had Iranian family backgrounds? The Silent War Continues….. Q",0.26266986,Federal Government is working very well with the Governors and State officials. Good things will happen! #KILLTHEVIRUS,0.53490317
">>7600180 Keep up the good fight, Anons. Q",0.26206195,"Lebron James was just interviewed by the dumbest man on television, Don Lemon. He made Lebron look smart, which isn’t easy to do. I like Mike!",0.8060606
">>8194659 Thank you, Baker(s)! THE BEST IS YET TO COME! [re: MSM] when facts and truth are NOT on your side what tactics must be deployed? [PS], what 'visibly' happens [re: [hidden] rats] during a fire? Q",0.25980955,“New Polls Say Most Americans Oppose Impeachment.” @foxandfriends  I did nothing wrong. This will be the first Impeachment ever where there was no crime. They don’t even allege a crime. Crazy!,0.55488425
"https://twitter.com/saracarterdc/status/1182260148334661632?lang=en  [Jul 8 2019] ""SURV of SC/JS terminated."" - Q Relevant to upcoming 'DECLAS' events? SIGINT FVEY/Domestic. Do you believe in coincidences? Mathematically impossible? 1/100? But, the ‘narrative’ suggests nothing is accurately ‘forecasted’ and this is simply a big ‘conspiracy’ theory [looney]. Ask yourself a very basic question – would the FAKE NEWS complex [NYT, WASHPOST, NBC, ABC, BBC, ………………………………………………………….] attack us if we weren’t a ‘real’ threat? Ask yourself a very basic question – why is the ‘forum’ where [drops] are made under constant attack?  Narrative: De-platform necessary ‘because’ precursor to violent acts posted there prior to carry-out. Precursor postings occurred on 4ch? FB? Twitter? Reddit? IG? ………….. Push to de-platform? Why only 8ch? [Bonus Question: Was the time of the posting pre/post actual ‘event’] Logical thinking. [Mar 20 2019] “Increase in attacks (de-platform, shill infiltration, MSM/Fake MAGA direct, link(s) to terrorism/acts of violence) only demonstrates validity and close proximity to JUSTICE [PAIN].” - Q Boomerang. You are witnessing the largest ‘organized’ disinformation campaign to ever be perpetuated on the public. Trust yourself. Be free in your thoughts. THE GREAT AWAKENING RETURN POWER TO THE PEOPLE. https://www.youtube.com/watch?v=G2qIXXafxCQ  It’s been a long time since we’ve had a non-corrupt President who works on behalf of the American people and not himself.  America is no longer for sale. Q",0.24253553,"“Nancy Pelosi has no leverage over the Senate. Mitch McConnell did not nose his way into the impeachment process in the House, and she has no standing in the Senate.” Brad Blakeman. Crazy Nancy should clean up her filthy dirty District &amp, help the homeless there. A primary for N?",0.5876557
"GANG of 8 DECLAS = [[[AS]]] ""Knowingly."" Q",0.24179345,Adam Schiff is a Corrupt Politician! https://t.co/16aSrqjwu2,0.7093121
"Once C_A always C_A? Former C_A elected to Congress? Former C_A running for Congress? Former C_A running for Senate? Former C_A elected to Senate? Former C_A elected to Presidency?  Define ‘black op’ [clandestine] Once C_A always C_A? @Snowden pre_NSA? @Snowden base of ops [geo location]? Whistleblower(s) vs. POTUS? Former C_A? Define ‘black op’ [clandestine] What happens if rogue elements of US AB[C] intel agency target [to insert] US political system [President, VP, House, Senate, NSC, US Amb., etc.] in ‘black op’ designated to control friend vs. foe targeting [self-preservation]?  NSA v C_A Q",0.24166013,The Do Nothing Democrats have gone Crazy. Very bad for USA! https://t.co/3zApgOOA7I,0.5876557
http://www.reuters.com/article/us-climate-change-accord-pelosi/us-house-speaker-pelosi-says-at-climate-summit-we-are-still-in-idUSKBN1Y61SZ  Who audits where the money actually goes? What % is typically categorized as costs? http://worldat1c.org/how-much-will-the-paris-agreement-cost-85f78d9a035a  How to 'steal' taxpayer money? The 'Con': >Determine 'topic(s)' that have emotional pull (connect) on 'vocal' types  >Create media blitz [scare] campaign ('talking points')('alarmist') >Use 'pro-narrative minded' authorities on subject to provide foundation to support  >Deploy 'circular reporting' and 'group-think' tactics (echo chamber) to artificially raise 'public outcry' >Use 'public outcry' to justify billion dollar taxpayer spend  >Rinse/repeat Who audits where the money goes? % to original mandate? Salary of a US Senator? Salary of a US Congressman/woman? Salary of a US President? Salary of a US Vice President? Net worth pre_office? Net worth post_office? How do elected officials become mega/multi-millionaires? Corruption. Logical thinking. Q,0.24088265,"The call to the Ukrainian President was PERFECT. Read the Transcript! There was NOTHING said that was in any way wrong. Republicans, don’t be led into the fools trap of saying it was not perfect, but is not impeachable. No, it is much stronger than that. NOTHING WAS DONE WRONG!",0.6364068
https://twitter.com/SeanPhillipHall/status/1204126165939572736  https://twitter.com/EatCrowDemoRats/status/1207715889128148992  [D] party election interference? [D] party corruption? Q,0.23977153,The World is using our laws to our detriment. They laugh at the Stupidity they see!,0.86563736
https://www.justice.gov/usao-nj/pr/new-jersey-corrections-officer-charged-receipt-child-pornography  Q,0.23967844,"The Democrats and Crooked Hillary paid for &amp, provided a Fake Dossier, with phony information gotten from foreign sources, pushed it to the corrupt media &amp, Dirty Cops, &amp, have now been caught. They spied on my campaign, then tried to cover it up - Just Like Watergate, but bigger!",0.53697914
Highly sophisticated 'State-level' attacks [v 8kun] followed by FAKE NEWS attacks [v Q] the next day? Coordinated? Ask yourself a simple question —– why? It's time to wake up. Q,0.23964198,READ THE TRANSCRIPTS!,0.5486472
>>7505194 Fake. Sometimes silence is necessary in order to protect select 'public' releases.  B2 (BB) 'public' statements past week? Durham 'public' statements past week? Durham start. Q start. Did you learn (4) FISAs last week re: POTUS? Non_public prior? Cruz_FISA public soon? Q,0.229586,"James Comey is a proven LEAKER &amp, LIAR. Virtually everyone in Washington thought he should be fired for the terrible job he did-until he was, in fact, fired. He leaked CLASSIFIED information, for which he should be prosecuted. He lied to Congress under OATH. He is a weak and.....",0.6627686
http://www.foxnews.com/us/naval-air-station-shooter-manifesto-us-nation-of-evil  Posted on Twitter prior to shooting? Calls to ban/remove Twitter? Calls to ban/remove 8ch for same reason? Congressional hearing? Why was there a coordinated effort to ban/remove 8ch? What was the reason? What was the REAL reason? Logical thinking. Q,0.2282116,There is right now a full scale manhunt going on in California for an illegal immigrant accused of shooting and killing a police officer during a traffic stop. Time to get tough on Border Security. Build the Wall!,0.6414081
