Q,Toxicity_score,T,Toxicity_score
https://www.theepochtimes.com/nsa-director-rogers-disclosed-fisa-abuse-days-after-carter-page-fisa-was-issued_2692033.html  Important to read and understand. Something BIG is coming. Q,0.07123716,"The Economy is soooo good, perhaps the best in our country’s history (remember, it’s the economy stupid!), that the Democrats are flailing &amp, lying like CRAZY! Phony books, articles and T.V. “hits” like no other pol has had to endure-and they are losing big. Very dishonest people!",0.7936143
Dough  https://pastebin.com/pdwphuug   can bake one more or defer,0.07121629,"Nancy Pelosi just stated that “it is dangerous to let the voters decide Trump’s fate.” @FoxNews  In other words, she thinks I’m going to win and doesn’t want to take a chance on letting the voters decide. Like Al Green, she wants to change our voting system. Wow, she’s CRAZY!",0.5554492
>>7561162 Correction 2. 'Your.' On the move - long night. Q,0.07038893,"So pathetic to see Sleepy Joe Biden, who with his son, Hunter, and to the detriment of the American Taxpayer, has ripped off at least two countries for millions of dollars, calling for my impeachment - and I did nothing wrong. Joe’s Failing Campaign gave him no other choice!",0.78636044
>>7561132 Correction. 'Squall.' On the move. Q,0.069560796,"“This ridiculous Impeachment is a travesty, it’s not an inquiry. Just read the transcript.” @LouDobbs",0.7875215
>>7561132 Correction. 'Squall.' On the move. Q,0.069560796,"The Radical Left, Do Nothing Democrats said they wanted to RUSH everything through to the Senate because “President Trump is a threat to National Security” (they are vicious, will say anything!), but now they don’t want to go fast anymore, they want to go very slowly. Liars!",0.77977926
https://twitter.com/Strandjunker/status/1228333628955996161  re: delayed testimony 1. allow for public dissemination of critical facts [possible unseal(s)-declas] prior to world televised sit down. Sometimes the necessary forum to update the American public is provided by those same people being investigated for…. Release to change strategy? Watch what happens next! Q,0.06930773,A despicable human being! https://t.co/3KpgUuRaXU,0.5514335
Justice. Q,0.06845501,"The United States has ended the ridiculous 230 Million Dollar yearly development payment to Syria. Saudi Arabia and other rich countries in the Middle East will start making payments instead of the U.S. I want to develop the U.S., our military and countries that help us!",0.54291046
"In case anybody missed it, it will surprise no one to learn that Soros is the #1 funding source behind Shadow:",0.06797269,"Sleepy Eyes Chuck Todd of Fake NBC News said it’s time for the Press to stop complaining and to start fighting back. Actually Chuck, they’ve been doing that from the day I announced for President. They’ve gone all out, and I WON, and now they’re going CRAZY!",0.53490317
">>7643842 orensicator’s first decisive findings, made public in the paper dated July 9, concerned the volume of the supposedly hacked material and what is called the transfer rate—the time a remote hack would require. The metadata established several facts in this regard with granular precision: On the evening of July 5, 2016, 1,976 megabytes of data were downloaded from the DNC’s server. The operation took 87 seconds. This yields a transfer rate of 22.7 megabytes per second.  These statistics are matters of record and essential to disproving the hack theory. No Internet service provider, such as a hacker would have had to use in mid-2016, was capable of downloading data at this speed. Compounding this contradiction, Guccifer claimed to have run his hack from Romania, which, for numerous reasons technically called delivery overheads, would slow down the speed of a hack even further from maximum achievable speeds.  https://www.thenation.com/article/a-new-report-raises-big-questions-about-last-years-dnc-hack/",0.06770131,He made same prediction in 2016. Nobody ever said Michael was stupid! https://t.co/XDEzsTS1Pt,0.83999324
You didn't think we highlighted 'Epstein' for no reason did you? Those who were once protected are no longer. Timing is EVERYTHING. Hunters become PREY. Q,0.06729714,"It’s incredible how Democrats can all use their ridiculous sound bite and say that a Wall doesn’t work. It does, and properly built, almost 100%! They say it’s old technology - but so is the wheel. They now say it is immoral- but it is far more immoral for people to be dying!",0.5275824
"Ask yourself a very simple question, why? The 'why' will be (publicly) answered soon. Dark > Light  Q",0.06571468,"I want to know, where is the money for Border Security and the WALL in this ridiculous Spending Bill, and where will it come from after the Midterms? Dems are obstructing Law Enforcement and Border Security. REPUBLICANS MUST FINALLY GET TOUGH!",0.65053135
Timing of impeachment vote [revised]? 7pm EST Interview w/ Barr? 7pm EST Coincidence?  Q,0.06544755,"Wow! Big pushback on Governor Andrew Cuomo of New York for his really dumb statement about America’s lack of greatness. I have already MADE America Great Again, just look at the markets, jobs, military- setting records, and we will do even better. Andrew “choked” badly, mistake!",0.7491408
https://twitter.com/genflynn/status/794651828981993473?lang=en  Targeted and silenced (gag) for a reason? PAIN coming. Q,0.06528484,"Democrats, who want Open Borders and care little about Crime, are incompetent, but they have the Fake News Media almost totally on their side!",0.6210605
"https://www.fisc.uscourts.gov/sites/default/files/MIsc%2019%2002%20191217.pdf  ""The frequency with which representations made by FBI personnel turned out to be unsupported or contradicted by information in their possession, and with which they withheld information detrimental to their case, calls into question whether information contained in other FBI applications is reliable."" Think FLYNN_FISA [ILLEGAL?] Q",0.06517547,".@SteveScalise blew the nasty &amp, obnoxious Chris Wallace (will never be his father, Mike!) away on Chris’s lowest rated (unless I’m on) morning show. This kind of dumb and unfair interview would never have happened in the @FoxNews past. Great job Steve!",0.7451167
http://twitter.com/realDonaldTrump/status/1201560862856601600  /trip_IDEN_delta[-1]/ Q,0.06503928,The Fake News of big ratings loser CNN. https://t.co/rYsv90cnvs,0.6364068
"Now, isn't that interesting? Q",0.06493145,"Despite the disgusting, illegal and unwarranted Witch Hunt, we have had the most successful first 17 month Administration in U.S. history - by far! Sorry to the Fake News Media and “Haters,” but that’s the way it is!",0.5595889
https://twitter.com/DocRock1007/status/1204513241507999745  When does the B2 drop the FIRST BOMB? Bill Barr fit into [8] spaces? Reconfig graphic. Knowledge is POWER.  Q,0.064493425,"Russia vows to shoot down any and all missiles fired at Syria. Get ready Russia,  because they will be coming, nice and new and “smart!” You shouldn’t be partners with a Gas Killing Animal who kills his people and enjoys it!",0.6721975
https://twitter.com/JipeFIN/status/1198297777677176832  The Great Awakening. WWG1WGA!!! Q,0.06441195,"Why did Nervous Nancy allow corrupt politician Shifty Schiff to lie before Congress? He must be a Witness, and so should she!",0.6115396
https://www.foxnews.com/politics/sessions-justice-department-has-27-investigations-into-epidemic-of-leaks  Worth remembering. [Whistleblower - source 1 & 2 NSC] Q,0.0640802,"....non-existent “sources” and a drunk/drugged up loser who hates Michael, a fine person with a wonderful family. Michael is a businessman for his own account/lawyer who I have always liked &amp, respected. Most people will flip if the Government lets them out of trouble, even if....",0.5319084
https://twitter.com/M2Madness/status/1209162450706280449  5:5? Q,0.06358142,"Michael Wolff is a total loser who made up stories in order to sell this really boring and untruthful book. He used Sloppy Steve Bannon, who cried when he got fired and begged for his job. Now Sloppy Steve has been dumped like a dog by almost everyone. Too bad! https://t.co/mEeUhk5ZV9",0.8060606
https://twitter.com/RudyGiuliani/status/1198309490069790720  It's going to be BIBLICAL!  THE GREAT AWAKENING. Q,0.06257234,"“Ralph Waldo Emerson seemed to foresee the lesson of the Senate Impeachment Trial of President Trump. ‘When you strike at the King, Emerson famously said, “you must kill him.’ Mr. Trump’s foes struck at him but did not take him down. A triumphant Mr.Trump emerges from the.....",0.61621237
>>7516470 >>7516476 >>7516480 >>7516469 This is exactly why we are here. Q,0.062438153,"The hatred and extreme bias of me by @CNN has clouded their thinking and made them unable to function. But actually, as I have always said, this has been going on for a long time. Little Jeff Z has done a terrible job, his ratings suck, &amp, AT&amp,T should fire him to save credibility!",0.70285386
>>7516470 >>7516476 >>7516480 >>7516469 This is exactly why we are here. Q,0.062438074,"Mini Mike is a 5’4” mass of dead energy who does not want to be on the debate stage with these professional politicians. No boxes please. He hates Crazy Bernie and will, with enough money, possibly stop him. Bernie’s people will go nuts!",0.69542736
"https://oig.justice.gov/press/2019/2019-12-09.pdf  Worth remembering. The day the public learned [4] FISAs? Dec 9, 2019. [Anons: August 31, 2018] The day the public learned illegal SURV (targeting) of Page (2)? January 23, 2020. [-Cruz] Important markers to remember. Watch the news. Q",0.061909303,"Study the late Joseph McCarthy, because we are now in period with Mueller and his gang that make Joseph McCarthy look like a baby! Rigged Witch Hunt!",0.5168674
>>7560920 Nothing is happening. Q,0.061593246,"...&amp, overwhelming,” but this Scam Impeachment was neither. Also, very unfair with no Due Process, proper representation, or witnesses. Now Pelosi is demanding everything the Republicans weren’t allowed to have in the House. Dems want to run majority Republican Senate. Hypocrites!",0.77342623
What advantages might exist when you know the other sides playbook? https://www.merriam-webster.com/dictionary/trap  Enjoy the show! Q,0.06144654,Schiff will change the transcripts just like he fraudulently made up the phone call. He is a corrupt politician! https://t.co/b12GFXv6tE,0.5883411
https://twitter.com/cjtruth/status/1228460719869394944  Q,0.06104051,"Somebody please tell incompetent (thanks for my high poll numbers) &amp; corrupt politician Adam “Shifty” Schiff to stop leaking Classified information or, even worse, made up information, to the Fake News Media. Someday he will be caught, &amp; that will be a very unpleasant experience!",0.5527547
https://www.washingtonexaminer.com/washington-secrets/bigger-than-vindman-trump-scrubs-70-obama-holdovers-from-nsc  We got what we needed. There is no step [5]. Thank you for playing. Q,0.060355444,"Nancy Pelosi’s District in California has rapidly become one of the worst anywhere in the U.S. when it come to the homeless &amp, crime. It has gotten so bad, so fast - she has lost total control and, along with her equally incompetent governor, Gavin Newsom, it is a very sad sight!",0.54379755
"https://time.com/5748850/uk-election-result-2019/  National pride. Independence. We, the People. Welcome to the Party. WWG1WGA!!! Q",0.060294613,"Two stone cold losers from Amazon WP. Almost every story is a made up lie, just like corrupt pol Shifty Schiff, who fraudulently made up my call with Ukraine. Fiction! https://t.co/0Oad0738NG",0.69383407
>>7359408 https://www.bbc.com/news/technology-44107570  Publicly known? Think non_public. Access granted. Q,0.060202323,"Pelosi doesn’t want to hand over The Articles of Impeachment, which were fraudulently produced by corrupt politicians like Shifty Schiff in the first place, because after all of these years of investigations and persecution, they show no crimes and are a joke and a scam!",0.60510075
"Be ready, Anons. Public awakening coming. Q",0.06015417,"Public opinion has turned strongly against the Rigged Witch Hunt and the “Special” Counsel because the public understands that there was no  Collusion with Russia (so ridiculous), that the two FBI lovers were a fraud against our Nation &amp, that the only Collusion was with the Dems!",0.6364068
https://twitter.com/BOOMER4K/status/1221471163785805826  Important. Q,0.060078576,"Another win just in. Nervous Nancy Pelosi and the Democrats in Congress sued me, thrown out. This one unanimous, in the D.C. Circuit.
Witch Hunt!",0.51890117
>>96 http://twitter.com/WWG1WGA_Every1/status/1203368497750913024  Q,0.059730515,"Fighting between various groups that has been going on for hundreds of years. USA should never have been in Middle East. Moved our 50 soldiers out. Turkey MUST take over captured ISIS fighters that Europe refused to have returned. The stupid endless wars, for us, are ending! https://t.co/Fbcem9i55Z",0.6449808
https://twitter.com/dbongino/status/1228389237688590336  Bigger [slam-dunk] charges coming? Q,0.059650827,25 Million Evangelical Christians are not registered to vote. We are working hard to get them registered! @robertjeffress @LouDobbs,0.5526453
https://www.dailywire.com/news/scandal-reopens-court-papers-on-democrat-it-aide-imran-awan-make-new-revelation  Q,0.059568893,"General Motors MUST immediately open their stupidly abandoned Lordstown plant in Ohio, or some other plant, and START MAKING VENTILATORS, NOW!!!!!!  FORD, GET GOING ON VENTILATORS, FAST!!!!!!  @GeneralMotors  @Ford",0.7093121
>>7516458 The IG report!,0.059292875,"The so-called leaks coming out of the White House are a massive over  exaggeration put out by the Fake News Media in order to make us look as bad as possible. With that being said, leakers are traitors and cowards, and we will find out who they are!",0.7008301
>>7516458 The IG report!,0.059292797,"“Congressman Schiff omitted and distorted key facts” @FoxNews  So, what else is new. He is a total phony!",0.7093121
"https://twitter.com/KarluskaP/status/1229415548938833920  https://www.justice.gov/file/1071991/download  [Pg 203] ""The OPA Supervisor said that he later learned that former President Clinton’s Secret Service detail had contacted Lynch’s FBI security detail and let them know that the former President wanted to meet with Lynch. Although Lynch’s staff was supposed to receive notice of such requests, witnesses told us that they were not informed of the request from former President Clinton."" Coordination?  Date of tarmac meeting? Date of [HRC] investigation END announcement?  1 + 1 = 2 It's going to be a very hot [spring/summer]. Q",0.059205685,"A lot of very good people were taken down by a small group of Dirty (Filthy) Cops, politicians, government officials, and an investigation that was illegally started &amp, that SPIED on my campaign. The Witch Hunt is sputtering badly, but still going on (Ukraine Hoax!). If this....",0.552916
https://twitter.com/3Days3Nights/status/1190742277771202560  https://twitter.com/SayWhenLA/status/1190757918712434689  RIG FOR RED Q,0.058819596,"Wow, Strzok-Page, the incompetent &amp, corrupt FBI lovers, have texts referring to a counter-intelligence operation into the Trump Campaign dating way back to December, 2015. SPYGATE is in full force! Is the Mainstream Media interested yet? Big stuff!",0.5752555
>>7560746  #5  https://twitter.com/thehill/status/1207695342776438787?s=19,0.058040466,"Why was the FBI’s sick loser, Peter Strzok, working on the totally discredited Mueller team of 13 Angry &amp, Conflicted Democrats, when Strzok was giving Crooked Hillary a free pass yet telling his lover, lawyer Lisa Page, that “we’ll stop” Trump from becoming President? Witch Hunt!",0.7743617
>>7889726 Article lacking source doc. https://www.fisc.uscourts.gov/sites/default/files/FISC%20Declassifed%20Order%2016-1182%2017-52%2017-375%2017-679%20%20200123.pdf  Q,0.057255384,"The Democrats &amp; Shifty Schiff, whose presentation to the Senate was loaded with lies and misrepresentations, are refusing to state that the Obama Administration withheld aid from many countries including Ukraine, Pakistan, Philippines, Egypt, Honduras, &amp; Mexico. Witch Hunt!",0.5154597
https://twitter.com/johncardillo/status/1228369145110188039  Q,0.05704854,"At the request of many, I will be reviewing the case of a “U.S. Military hero,” Major Matt Golsteyn, who is charged with murder. He could face the death penalty from our own government after he admitted to killing a Terrorist bomb maker while overseas. @PeteHegseth @FoxNews",0.5519422
">>7516458 IG tweet, Durham statement!",0.05699683,"The United States has foolishly given Pakistan more than 33 billion dollars in aid over the last 15 years, and they have given us nothing but lies &amp, deceit, thinking of our leaders as fools. They give safe haven to the terrorists we hunt in Afghanistan, with little help. No more!",0.7093121
">>7516458 IG tweet, Durham statement!",0.05699683,"Mini Mike, don’t lick your dirty fingers. Both unsanitary and dangerous to others and yourself! https://t.co/LsKLZNeZL9",0.69542736
https://twitter.com/stormypatriot21/status/1193957884700299264  Q,0.056989178,"With all of the failed “experts” weighing in, does anybody really believe that talks and dialogue would be going on between North and South Korea right now if I wasn’t firm, strong and willing to commit our total “might” against the North. Fools, but talks are a good thing!",0.575675
https://www.washingtonexaminer.com/news/durham-scrutinizing-john-brennans-handling-of-russian-interference-in-2016  Read carefully. Sound familiar? Sometimes a leak turns into a flood.  Q,0.05687007,"The noble people of Iran—who love America—deserve a government that's more interested in helping them achieve their dreams than killing them for demanding respect. Instead of leading Iran toward ruin, its leaders should abandon terror and Make Iran Great Again! https://t.co/RLjGsC5WLc",0.5508718
https://twitter.com/USABookClub/status/1211018562002980866  Easy to understand? Q,0.056586783,"Corrupt politician Adam Schiff’s lies are growing by the day. Keep fighting tough, Republicans, you are dealing with human scum who have taken Due Process and all of the Republican Party’s rights away from us during the most unfair hearings in American History......",0.8430969
">>8200718 You have come far, Anons (Patriots). You are ready. https://www.youtube.com/watch?v=B5T7Gr5oJbM  Prepare for the storm. Q",0.05608653,Wow! The NSA has deleted 685 million phone calls and text messages. Privacy violations? They blame technical irregularities. Such a disgrace. The Witch Hunt continues!,0.55791897
>>7637731 When will they ask the question?,0.055675786,"....it to Congress, and the American people, as though it was the statement of the President of the United States, me. He did it to fool Congress and the public in order to make me look BAD. He is a sick puppy!",0.8160192
https://twitter.com/HYVEE7/status/1210685913996636166  Do you believe in coincidences? Q,0.055489197,".....Will the FBI ever recover it’s once stellar reputation, so badly damaged by Comey, McCabe, Peter S and his lover, the lovely Lisa Page, and other top officials now dismissed or fired? So many of the great men and women of the FBI have been hurt by these clowns and losers!",0.80780447
"Chairman Graham, it's time. Senate was the target. Q",0.05520166,"This is an illegally brought Rigged Witch Hunt run by people who are totally corrupt and/or conflicted. It was started and paid for by Crooked Hillary and the Democrats. Phony Dossier, FISA disgrace and so many lying and dishonest people already fired. 17 Angry Dems? Stay tuned!",0.60467297
IG Report announcement,0.054363243,"To the people of South Carolina, Tom Steyer is a joke, laughed at by everyone, a total incompetent. He made money in coal, now he “hates” coal. Did you see him fawning over Crazy Bernie? Has no chance, a loser for South Carolina, doesn’t deserve your vote!",0.7087285
IG Report announcement,0.054363243,"Is corrupt Bloomberg News going to say what a pathetic debater Mini Mike is, that he doesn’t respect our great farmers, or that he has violated campaign finance laws at the highest and most sinister level with “payoffs” all over the place?",0.69542736
National Presidential Alert System [2]. Why was this created and tested? Political warfare. Information warfare. Q,0.054351185,"When people come into our Country illegally, we must IMMEDIATELY escort them back out without going through years of legal maneuvering. Our laws are the dumbest anywhere in the world. Republicans want Strong Borders and no Crime. Dems want Open Borders and are weak on Crime!",0.72538143
Month/day 'Durham' initiated? Month/day 'Q' public campaign initiated?  How many coincidences before mathematically impossible?  It was over before it began. Q,0.054318104,"DOJ just issued the McCabe report - which is a total disaster. He LIED! LIED! LIED! McCabe was totally controlled by Comey - McCabe is Comey!! No collusion, all made up by this den of thieves and lowlifes!",0.6735608
https://twitter.com/LadyRedWave/status/1206267112647348225  THE GREAT AWAKENING. Q,0.05332548,"....Tariffs will make our country much richer than it is today. Only fools would disagree. We are using them to negotiate fair trade deals and, if countries are still unwilling to negotiate, they will pay us vast sums of money in the form of Tariffs. We win either way......",0.6931337
https://www.youtube.com/watch?v=wrZejBRSAO8  Q,0.05330848,I will always stand with the State of Israel and the Jewish people. I strongly support their safety and security and their right to live within their historical homeland. It's time for peace! https://t.co/lKwQ9IKTUG,0.5748459
https://twitter.com/BOOMER4K/status/1221471163785805826  Worth remembering. Q,0.0533067,"Such a disgrace that the Do Nothing Democrats are doing just as their name suggests, Doing Nothing! USMCA anyone?",0.53444034
https://twitter.com/sapna/status/1223639939931410435  [Epstein] [Wexner] The story goes much deeper [darker]. Q,0.05317615,"I love Michigan, one of the reasons we are doing such a GREAT job for them during this horrible Pandemic. Yet your Governor, Gretchen “Half” Whitmer is way in over her head, she doesn’t have a clue. Likes blaming everyone for her own ineptitude! #MAGA",0.5544201
https://twitter.com/NatSecLisa/status/1206957392275087360  Propaganda. GoFundMe next? https://www.wikihow.com/Prepare-for-Jail  Q,0.0530667,".@SteveScalese blew the nasty &amp, obnoxious Chris Wallace (will never be his father, Mike!) away on Chris’s lowest rated (unless I’m on) morning show. This kind of dumb and unfair interview would never have happened in the @FoxNews past. Great job Steve!",0.74529785
>>7643247 Geo location 2015-2017? Q,0.053005252,"....,the only Collusion with Russia was with the Democrats, so now they are looking at my Tweets (along with 53 million other people) - the rigged Witch Hunt continues! How stupid and unfair to our Country....And so the Fake News doesn’t waste my time with dumb questions, NO,....",0.8355208
>>7359370 /pf/ was taken down [cleared of content] just prior to platform TERM [specific reason]. NAT SEC [charter] prevents use of 'keys' to establish IDEN via public utility/domain - non_reg. Formation of 'clean' board possible to lock in trip(s) > issues w/ safeguards.  Q,0.052367106,"Kim Strassel of the WSJ just said, after reviewing the dumb Comey Memos, “you got to ask, what was the purpose of the Special Counsel? There’s no there there.” Dan Henninger of the WSJ said Memos would show that this would be one of the weakest obstruction cases ever brought!",0.60675275
>>7359370 /pf/ was taken down [cleared of content] just prior to platform TERM [specific reason]. NAT SEC [charter] prevents use of 'keys' to establish IDEN via public utility/domain - non_reg. Formation of 'clean' board possible to lock in trip(s) > issues w/ safeguards.  Q,0.052367106,"If anybody but your favorite President, Donald J. Trump, announced that, after decimating ISIS in Syria, we were going to bring our troops back home (happy &amp, healthy), that person would be the most popular hero in America. With me, hit hard instead by the Fake News Media. Crazy!",0.6048291
"https://www.youtube.com/watch?v=vDi1oAC-wSY  “For every item that carries the darkness of humanity there's one that holds the light. And that light is worth believing in. Not just in others, but in yourself as well.” ― C.M. Rayne Trust and believe in yourself. The Silent War Continues…. Q",0.052045558,"....I have seen some of the regulations being circulated, including those being contemplated by Congress, and they are ridiculous. I want to make it EASY to do business with the United States, not difficult. Everyone in my Administration is being so instructed, with no excuses...",0.5361717
DJT retweets himself 2 hrs later Driving the point home.,0.051775105,The United States has an $800 Billion Dollar Yearly Trade Deficit because of our “very stupid” trade deals and policies. Our jobs and wealth are being given to other countries that have taken advantage of us for years. They laugh at what fools our leaders have been. No more!,0.82988364
